{
  "$schema": "http://json-schema.org/draft-07/schema#",
  "title": "Event Descriptor",
  "description": "JSON schema for event descriptors",
  "$ref": "#/definitions/EventDescriptor",
  "definitions": {
    "EventDescriptor": {
      "type": "object",
      "properties": {
        "eventName": {
          "type": "string",
          "minLength": 10
        },
        "definingSystem": {
          "type": "string",
          "minLength": 2
        },
        "publishingSystem": {
          "type": "string",
          "minLength": 2,
          "$comment": "deprecated - use definingSystem"
        },
        "description": {
          "type": "string"
        },
        "documentationUrl": {
          "$ref": "common.schema.json#/definitions/url"
        },
        "scope": {
          "type": "string",
          "enum": [
            "public",
            "internal"
          ]
        },
        "topic": {
          "type": "string"
        },
        "compatibilityMode": {
          "$ref": "common.schema.json#/definitions/compatibilityMode"
        },
        "versions": {
          "$ref": "common.schema.json#/definitions/Versions"
        }
      },
      "required": [
        "eventName",
        "description",
        "scope"
      ],
      "anyOf": [
        {
          "required": [
            "publishingSystem"
          ]
        },
        {
          "required": [
            "definingSystem"
          ]
        }
      ],
      "additionalProperties": false
    }
  }
}
