{
  "eventName": "JmeOrderValidatedEvent",
  "description": "Order validated (sequential inbox example)",
  "publishingSystem": "JME",
  "topic": "jme-order-validated",
  "scope": "public",
  "versions": [
    {
      "version": "1.0.0",
      "valueSchema": "JmeOrderValidatedEvent_v1.avdl"
    },
    {
      "version": "1.1.0",
      "valueSchema": "JmeOrderValidatedEvent_v1.1.0.avdl",
      "compatibilityMode": "FORWARD"
    },
    {
      "version": "1.2.0",
      "valueSchema": "JmeOrderValidatedEvent_v1.2.0.avdl",
      "compatibilityMode": "FULL"
    }
  ]
}
