{
  "eventName": "JmeDocumentVersionReviewedEvent",
  "publishingSystem": "JME",
  "description": "Notification that a document version has been reviewed.",
  "topic": "jme-document-version-reviewed",
  "scope": "internal",
  "versions": [
    {
      "version": "1.0.0",
      "valueSchema": "JmeDocumentVersionReviewedEvent_v1.0.0.avdl",
      "compatibilityMode": "FORWARD"
    }
  ]
}
