{
  "eventName": "JmeRaceCarTirePressureCheckedEvent",
  "description": "Race car tire pressure check completed",
  "publishingSystem": "JME",
  "topic": "jme-race-tire-pressure-checked",
  "scope": "internal",
  "versions": [
    {
      "version": "1.0.0",
      "valueSchema": "JmeRaceCarTirePressureCheckedEvent_v1.avdl"
    },
    {
      "version": "2.0.0",
      "valueSchema": "JmeRaceCarTirePressureCheckedEvent_v2.avdl",
      "compatibilityMode": "BACKWARD"
    }
  ]
}
