{
  "eventName": "JmeDiagramVersionCreatedEvent",
  "publishingSystem": "JME",
  "description": "Notification that a new diagram version has been created.",
  "topic": "jme-process-archive-diagramversioncreated",
  "scope": "internal",
  "versions": [
    {
      "version": "1.0.0",
      "valueSchema": "JmeDiagramVersionCreatedEvent_v1.0.0.avdl",
      "compatibilityMode": "FORWARD"
    }
  ]
}
