{
  "eventName": "JmeDeclarationCreatedEvent",
  "publishingSystem": "JME",
  "description": "Customs declaration created event",
  "topic": "jme-messaging-declaration-created",
  "scope": "internal",
  "versions": [
    {
      "version": "1.1.0",
      "valueSchema": "JmeDeclarationCreatedEvent_v1.avdl",
      "keySchema": "JmeDeclarationCreatedEvent_key_v1.avdl"
    },
    {
      "version": "1.2.0",
      "valueSchema": "JmeDeclarationCreatedEvent_v2.avdl",
      "keySchema": "JmeDeclarationCreatedEvent_key_v2.avdl"
    },
    {
      "version": "1.3.0",
      "valueSchema": "JmeDeclarationCreatedEvent_v3.avdl",
      "keySchema": "ch.admin.bit.jme.declaration.BeanReferenceMessageKey.avdl"
    },
    {
      "version": "1.4.0",
      "valueSchema": "JmeDeclarationCreatedEvent_v4.avdl",
      "keySchema": "ch.admin.bit.jme.declaration.BeanReferenceMessageKey.avdl"
    },
    {
      "version": "1.4.1",
      "valueSchema": "JmeDeclarationCreatedEvent_v1.4.1.avdl",
      "keySchema": "ch.admin.bit.jme.declaration.BeanReferenceMessageKey.avdl",
      "compatibilityMode": "FORWARD"
    },
    {
      "version": "1.5.0",
      "valueSchema": "JmeDeclarationCreatedEvent_v5.avdl",
      "keySchema": "ch.admin.bit.jme.declaration.BeanReferenceMessageKey.avdl",
      "compatibilityMode": "BACKWARD"
    }
  ]
}
