{
  "eventName": "JmeGameReviewCreatedEvent",
  "publishingSystem": "JME",
  "description": "A game review has been created",
  "topic": "jme-crypto-game-review-created",
  "scope": "internal",
  "versions": [
    {
      "version": "1.0.0",
      "valueSchema": "JmeGameReviewCreatedEvent_v1.avdl",
      "compatibilityMode": "FORWARD"
    }
  ]
}
